"DESCRIPTION","DURATION IN MS","NAME","PARENT SUITE","START TIME","STATUS","STOP TIME","SUB SUITE","SUITE","TEST CLASS","TEST METHOD"
"Build and deploy one unit of PostgreSQL and then test the available plugins.","332621","test_plugins","tests.integration","Sat May 31 01:30:03 UTC 2025","passed","Sat May 31 01:35:35 UTC 2025","","test_plugins","",""
"Test that there is no read-only endpoint in a standalone cluster.","89343","test_primary_read_only_endpoint_in_standalone_cluster","tests.integration.new_relations","Sat May 31 01:47:43 UTC 2025","passed","Sat May 31 01:49:12 UTC 2025","","test_new_relations_1","",""
"Simple test to ensure that the PostgreSQL and application charms get deployed.","259640","test_deploy_stable","tests.integration.ha_tests","Sat May 31 01:34:06 UTC 2025","passed","Sat May 31 01:38:25 UTC 2025","","test_upgrade_from_stable","",""
"","0","test_upgrade","tests.integration.ha_tests","Sat May 31 01:30:44 UTC 2025","skipped","Sat May 31 01:30:44 UTC 2025","","test_upgrade_to_primary_label","",""
"Check that writes in one cluster are not replicated to another cluster.","285707","test_no_data_replicated_between_clusters","tests.integration.ha_tests","Sat May 31 01:40:05 UTC 2025","passed","Sat May 31 01:44:51 UTC 2025","","test_replication","",""
